{
  "color": {
    "themes": [
      "light",
      "dark",
      "light-ic",
      "dark-ic"
    ],
    "tokens": [
      {
        "name": "p-document-canvas",
        "value": "{p-surface-1}",
        "usage": "保留旧名，重绑定到显式表面阶梯；见迁移表"
      },
      {
        "name": "document-canvas",
        "value": "{p-document-canvas}",
        "usage": "正文与文档的默认不透明底面"
      },
      {
        "name": "p-surface-panel",
        "value": "{p-surface-2}",
        "usage": "保留旧名，重绑定到显式表面阶梯；见迁移表"
      },
      {
        "name": "surface-panel",
        "value": "{p-surface-panel}",
        "usage": "surface panel 语义角色"
      },
      {
        "name": "p-surface-sidebar",
        "value": "{p-surface-0}",
        "usage": "保留旧名，重绑定到显式表面阶梯；见迁移表"
      },
      {
        "name": "surface-sidebar",
        "value": "{p-surface-sidebar}",
        "usage": "surface sidebar 语义角色"
      },
      {
        "name": "p-primary-text",
        "value": {
          "light": "#151515",
          "dark": "#F5F5F5",
          "light-ic": "#141412",
          "dark-ic": "#FFFFFF"
        },
        "usage": "普通主题对齐中性表面；辅助文字与必要边界经过可读性适配"
      },
      {
        "name": "primary-text",
        "value": "{p-primary-text}",
        "usage": "主要正文、标题、字段标签"
      },
      {
        "name": "p-secondary-text",
        "value": {
          "light": "#525252",
          "dark": "#A3A3A3",
          "light-ic": "#2F2D29",
          "dark-ic": "#F4EEE2"
        },
        "usage": "普通主题对齐中性表面；辅助文字与必要边界经过可读性适配"
      },
      {
        "name": "secondary-text",
        "value": "{p-secondary-text}",
        "usage": "说明、次要信息；仍须满足正文对比度"
      },
      {
        "name": "p-tertiary-text",
        "value": {
          "light": "#606060",
          "dark": "#B4B4B0",
          "light-ic": "#37352F",
          "dark-ic": "#F4EEE2"
        },
        "usage": "普通主题对齐中性表面；辅助文字与必要边界经过可读性适配"
      },
      {
        "name": "tertiary-text",
        "value": "{p-tertiary-text}",
        "usage": "时间戳和次级元信息；不得用降低透明度代替"
      },
      {
        "name": "p-disabled-text",
        "value": {
          "light": "#918B81",
          "dark": "#807A70",
          "light-ic": "#767066",
          "dark-ic": "#A09A90"
        },
        "usage": "基础色值；仅语义层引用。"
      },
      {
        "name": "disabled-text",
        "value": "{p-disabled-text}",
        "usage": "只用于确实不可操作的控件；禁用原因仍用 secondary-text"
      },
      {
        "name": "p-selected-text",
        "value": {
          "light": "#151515",
          "dark": "#FFFFFF",
          "light-ic": "#000000",
          "dark-ic": "#000000"
        },
        "usage": "基础色值；仅语义层引用。"
      },
      {
        "name": "selected-text",
        "value": "{p-selected-text}",
        "usage": "文本选区内统一前景，包括代码、链接和 diff 的被选中文字"
      },
      {
        "name": "p-row-selection",
        "value": {
          "light": "#E6E6E4",
          "dark": "#2A2A29",
          "light-ic": "#D8DEDE",
          "dark-ic": "#414C4C"
        },
        "usage": "普通主题对齐中性表面；辅助文字与必要边界经过可读性适配"
      },
      {
        "name": "row-selection",
        "value": "{p-row-selection}",
        "usage": "持久选中底，不表示 hover、checked 或 keyboard focus"
      },
      {
        "name": "p-row-selection-hover",
        "value": {
          "light": "#DCDCD9",
          "dark": "#343433",
          "light-ic": "#CCD5D5",
          "dark-ic": "#465151"
        },
        "usage": "普通主题对齐中性表面；辅助文字与必要边界经过可读性适配"
      },
      {
        "name": "row-selection-hover",
        "value": "{p-row-selection-hover}",
        "usage": "已选中行的 hover，保留持久标记"
      },
      {
        "name": "p-button-hover",
        "value": {
          "light": "#E9E9E7",
          "dark": "#272726",
          "light-ic": "#DEDDD7",
          "dark-ic": "#36332D"
        },
        "usage": "普通主题对齐中性表面；辅助文字与必要边界经过可读性适配"
      },
      {
        "name": "button-hover",
        "value": "{p-button-hover}",
        "usage": "按钮或独立点击面的 hover 底"
      },
      {
        "name": "p-button-pressed",
        "value": {
          "light": "#DDDDDA",
          "dark": "#323231",
          "light-ic": "#D0CEC8",
          "dark-ic": "#4C4740"
        },
        "usage": "普通主题对齐中性表面；辅助文字与必要边界经过可读性适配"
      },
      {
        "name": "button-pressed",
        "value": "{p-button-pressed}",
        "usage": "按下期间的瞬时底；松开后由状态机回到 hover/rest"
      },
      {
        "name": "p-transcript-input",
        "value": "{p-surface-3}",
        "usage": "保留旧名，重绑定到显式表面阶梯；见迁移表"
      },
      {
        "name": "transcript-input",
        "value": "{p-transcript-input}",
        "usage": "transcript input 语义角色"
      },
      {
        "name": "p-border",
        "value": {
          "light": "#737370",
          "dark": "#A3A39E",
          "light-ic": "#4E4A41",
          "dark-ic": "#C8C0B4"
        },
        "usage": "普通主题对齐中性表面；辅助文字与必要边界经过可读性适配"
      },
      {
        "name": "border",
        "value": "{p-border}",
        "usage": "必要的控件边界，按实际相邻背景校验至少 3:1"
      },
      {
        "name": "p-border-focused",
        "value": {
          "light": "#42423F",
          "dark": "#EEEEEA",
          "light-ic": "#111111",
          "dark-ic": "#FFFFFF"
        },
        "usage": "普通主题对齐中性表面；辅助文字与必要边界经过可读性适配"
      },
      {
        "name": "border-focused",
        "value": "{p-border-focused}",
        "usage": "中性 1pt 自绘焦点轮廓，不偏移、不换品牌色"
      },
      {
        "name": "p-separator",
        "value": {
          "light": "#DFDFDD",
          "dark": "#353533",
          "light-ic": "#8C867D",
          "dark-ic": "#9C9488"
        },
        "usage": "普通主题对齐中性表面；辅助文字与必要边界经过可读性适配"
      },
      {
        "name": "separator",
        "value": "{p-separator}",
        "usage": "非必要的分组装饰线，不能单独承担控件识别或选中标记"
      },
      {
        "name": "accent",
        "value": "{p-accent}",
        "usage": "消费者品牌派生的可读强调/链接前景，不承诺任何固定色相"
      },
      {
        "name": "p-warning-foreground",
        "value": {
          "light": "#A03C00",
          "dark": "#FFA85C",
          "light-ic": "#762B00",
          "dark-ic": "#FFD29B"
        },
        "usage": "基础色值；仅语义层引用。"
      },
      {
        "name": "warning-foreground",
        "value": "{p-warning-foreground}",
        "usage": "警告文字前景；限定在质量清单登记的背景上"
      },
      {
        "name": "p-warning",
        "value": {
          "light": "#F3CE67",
          "dark": "#E4B751",
          "light-ic": "#F0C442",
          "dark-ic": "#FFD65A"
        },
        "usage": "基础色值；仅语义层引用。"
      },
      {
        "name": "warning",
        "value": "{p-warning}",
        "usage": "警告实体底，不能直接用于普通背景上的小字号文字"
      },
      {
        "name": "p-warning-text",
        "value": {
          "light": "#000000",
          "dark": "#000000",
          "light-ic": "#000000",
          "dark-ic": "#000000"
        },
        "usage": "基础色值；仅语义层引用。"
      },
      {
        "name": "warning-text",
        "value": "{p-warning-text}",
        "usage": "只用于 warning 黄色面上的黑字"
      },
      {
        "name": "p-status-running",
        "value": {
          "light": "#8A4B00",
          "dark": "#F5BE74",
          "light-ic": "#663400",
          "dark-ic": "#FFE1B8"
        },
        "usage": "基础色值；仅语义层引用。"
      },
      {
        "name": "status-running",
        "value": "{p-status-running}",
        "usage": "status running 语义角色"
      },
      {
        "name": "p-status-failed",
        "value": {
          "light": "#A42F35",
          "dark": "#FFB1B1",
          "light-ic": "#7D1421",
          "dark-ic": "#FFD0D4"
        },
        "usage": "基础色值；仅语义层引用。"
      },
      {
        "name": "status-failed",
        "value": "{p-status-failed}",
        "usage": "status failed 语义角色"
      },
      {
        "name": "p-status-succeeded",
        "value": {
          "light": "#21633F",
          "dark": "#96D9AC",
          "light-ic": "#124C2B",
          "dark-ic": "#BDFFD2"
        },
        "usage": "基础色值；仅语义层引用。"
      },
      {
        "name": "status-succeeded",
        "value": "{p-status-succeeded}",
        "usage": "status succeeded 语义角色"
      },
      {
        "name": "p-status-info",
        "value": {
          "light": "#285B8D",
          "dark": "#A8D1FF",
          "light-ic": "#143F6B",
          "dark-ic": "#D1E7FF"
        },
        "usage": "基础色值；仅语义层引用。"
      },
      {
        "name": "status-info",
        "value": "{p-status-info}",
        "usage": "status info 语义角色"
      },
      {
        "name": "p-diff-added-surface",
        "value": {
          "light": "#E5F0E8",
          "dark": "#23362A",
          "light-ic": "#CDE6D4",
          "dark-ic": "#233E2C"
        },
        "usage": "基础色值；仅语义层引用。"
      },
      {
        "name": "diff-added-surface",
        "value": "{p-diff-added-surface}",
        "usage": "diff added surface 语义角色"
      },
      {
        "name": "p-diff-removed-surface",
        "value": {
          "light": "#F8E8E8",
          "dark": "#3B2729",
          "light-ic": "#F0D8DC",
          "dark-ic": "#45292E"
        },
        "usage": "基础色值；仅语义层引用。"
      },
      {
        "name": "diff-removed-surface",
        "value": "{p-diff-removed-surface}",
        "usage": "diff removed surface 语义角色"
      },
      {
        "name": "p-code-surface",
        "value": "{p-surface-2}",
        "usage": "保留旧名，重绑定到显式表面阶梯；见迁移表"
      },
      {
        "name": "code-surface",
        "value": "{p-code-surface}",
        "usage": "代码/终端面；ANSI 和语法高亮须另映射语义角色"
      },
      {
        "name": "p-text-selection",
        "value": {
          "light": "#C9D7EA",
          "dark": "#42566F",
          "light-ic": "#A8BEDC",
          "dark-ic": "#B5CEEF"
        },
        "usage": "基础色值；仅语义层引用。"
      },
      {
        "name": "text-selection",
        "value": "{p-text-selection}",
        "usage": "普通主题不透明；增强对比度使用 alpha-selection-ic 作为最终背景 alpha"
      },
      {
        "name": "p-scrim",
        "value": {
          "light": "#000000",
          "dark": "#000000",
          "light-ic": "#000000",
          "dark-ic": "#000000"
        },